{
  "schema_version": "1.0",
  "run": {
    "run_id": "20260715T150000Z-local-example",
    "started_at": "2026-07-15T15:00:00Z",
    "ended_at": "2026-07-15T15:00:09Z",
    "executor": "example-ai-runner",
    "scope": "targeted",
    "notes": "Partial example; validate with --allow-partial."
  },
  "environment": {
    "git_commit": "0123456789abcdef",
    "dirty": false,
    "agent_version": "2026-07-15.5",
    "frontend_url": "http://localhost:5175",
    "agent_url": "http://localhost:8080",
    "backend_url": "http://localhost:3000",
    "feature_flags": {"USE_LANGGRAPH_FREEFORM": true, "USE_CAMPAIGN_AUTOPILOT": true},
    "models": {"chat": "minimax/minimax-m2.5", "reranker": "qwen/qwen3-reranker-8b", "vlm": "google/gemma-4-31b-it"},
    "catalogs": {"audience_fingerprint": "example-redacted", "targeting_fingerprint": "example-redacted"},
    "containers": {"agent": "healthy", "frontend": "healthy", "backend": "healthy", "mongo": "healthy"},
    "browser_profiles": ["Chromium 1440x900"],
    "deviations": []
  },
  "results": [
    {
      "scenario_id": "BR-001",
      "suite": "brief",
      "priority": "P0",
      "status": "pass",
      "started_at": "2026-07-15T15:00:01Z",
      "duration_ms": 8123,
      "input": ["bán khô gà, brand mixifood, budget 2 triệu, chạy 3 ngày từ 15/7", "chọn giúp mình luôn"],
      "expected_assertions": ["A durable workspace_proposal is returned", "Canonical brief remains missing before approval", "The date range is 2026-07-15 through 2026-07-17"],
      "observations": ["meta.tool=workspace_proposal", "pending proposal count=1", "canonical brief=null"],
      "response": {"http_status": 200, "meta_tool": "workspace_proposal", "block_types": ["workspace_proposal"]},
      "state_before": {"revision": 1, "brief": null},
      "state_after": {"revision": 1, "brief": null, "pending_proposal_count": 1},
      "metrics": {"chat_latency_ms": 8123},
      "evidence": [{"kind": "api", "path": "evidence/api/BR-001.json", "description": "Redacted chat and workspace responses", "request_id": "req-example", "trace_id": null}],
      "defects": [],
      "notes": "No canonical mutation occurred.",
      "blocked_reason": null
    }
  ],
  "summary": {
    "total": 1,
    "pass": 1,
    "fail": 0,
    "blocked": 0,
    "not_run": 0,
    "by_suite": {"brief": {"total": 1, "pass": 1, "fail": 0, "blocked": 0, "not_run": 0}},
    "release_gate": "incomplete",
    "blockers": 0,
    "majors": 0,
    "top_findings": []
  }
}
